{
  "externalRefId": "9d7f1d67-5d54-4b00-9d6c-3a8f7fb2e1c4",
  "formId": "SA300",
  "properties": [
    {
      "property": {
        "name": "printedVariant",
        "value": "true"
      }
    },
    {
      "property": {
        "name": "printedVariant1",
        "value": "false"
      }
    }
  ],
  "reason": "EMAIL_BOUNCE",
  "sourceData": "SGVsbG8gd29ybGQ=",
  "emailAddress": "someEmail@test.com"
}
